{
  "agent_id": "data_cleaner",
  "run_id": "run_data_cleaner_001",
  "status": "completed",
  "started_at": "2026-05-29T10:15:00Z",
  "completed_at": "2026-05-29T10:15:07Z",
  "user_request": "Clean my customer records dataset",
  "steps": [
    {
      "step": 1,
      "action": "Receive user request",
      "details": "Parsed request: clean dataset, focus on duplicates, missing values, and date formats"
    },
    {
      "step": 2,
      "action": "Identify required tools",
      "details": "Agent manifest requires: csv_reader, data_cleaning_module"
    },
    {
      "step": 3,
      "action": "Call mock tool",
      "tool": "csv_reader",
      "input": { "file": "customer_records.csv" },
      "output_summary": "Loaded 10,000 rows from dataset"
    },
    {
      "step": 4,
      "action": "Process tool response",
      "details": "Detected 245 missing emails, 32 duplicate IDs, 78 inconsistent date formats"
    },
    {
      "step": 5,
      "action": "Apply cleaning operations",
      "details": "Removed duplicates, standardized dates, imputed missing emails",
      "output_summary": "Cleaned 355 rows"
    },
    {
      "step": 6,
      "action": "Generate final answer",
      "details": "Produced cleaned dataset and summary report"
    },
    {
      "step": 7,
      "action": "Save run history",
      "details": "Run logged to trace store with run_id run_data_cleaner_001"
    }
  ],
  "final_output": {
    "cleaned_dataset": "customer_records_clean.csv",
    "summary": "Processed 10,000 rows. Cleaned 355 rows (duplicates removed, dates standardized, missing emails imputed).",
    "rows_processed": 10000,
    "rows_cleaned": 355,
    "rows_remaining": 9645
  }
}